83;how;{"type":"how", "question":"Как общаются слоны?", "answer":"Ученые Стэнфордского университета сделали удивительное открытие: слоны общаются друг с другом с помощью... ног. Дело в том, что, топая ногами, слоны создают сильную вибрацию, которая ощущается на расстоянии более 30 километров. Таким образом эти огромные животные предупреждают своих собратьев об опасности, находят заблудившихся сородичей, сообщают о местонахождении ближайшего водоема."}
84;how;{"type":"how", "question":"Когда кошки стали домашними животными?", "answer":"Судя по всему, домашние кошки живут бок о бок с человеком почти десять тысяч лет.  В местечке Шиллоу-рокамбос на средиземноморском острове Кипр французские археологи раскопали погребение, в котором кошка похоронена со всеми почестями рядом со своим хозяином."}
85;when;{"type":"when", "question":"Когда люди начали пить чай?", "answer":"Древние китайские письменные источники свидетельствуют, что 5 с лишним тысяч лет назад дикий чай сумели окультурить и стали выращивать на плантациях. Значит, уже тогда в Китае пили чай."}
86;who;{"type":"who", "question":"Кто первым сказал, что Земля вращается вокруг Солнца?", "answer":"Еще древнегреческий астроном Аристарх Самосский, живший в 3 веке до н. э., пришел к выводу, что Земля вращается вокруг своей оси и движется вокруг Солнца. Более того, он предположил, что все планеты также обращаются вокруг Солнца"}
87;who;{"type":"who", "question":"Кто придумал ЛЕГО?", "answer":"Отцом популярнейшего детского конструктора был Оле Кирк Кристиансен — датский плотник, который в 1932 году создал компанию по выпуску деревянных игрушек. Задача, которая стояла перед работниками компании (поначалу она состояла всего из 7 человек), — создать игрушки, развивающие воображение, изобретательность и творческие способности ребенка. Название 'ЛЕ ГО' произошло от двух датских слов — 'leg' (игра) и 'godt' (удовольствие)."}
88;who;{"type":"who", "question":"Кто дольше всех живет?", "answer":"Самые большие долгожители — морские черепахи Продолжительность их жизни более ста пятидесяти лет. Недалеко от них ушли и рыбы - некоторые из них, в основном осетровые, живут до 100 лет."}
89;whatis;{"type":"whatis", "question":"Что такое цунами?", "answer":"Цунами - это огромные волны в океание, возникающие в результате природных катаклизмов, от центра возникновения они распространяются во все стороны."}
90;whatis;{"type":"whatis", "question":"Что такое смерч и торнадо?", "answer":"Смерч - это возникшая из-за разности давления гигантская воздушная воронка. Она вращается с бешеной скоростью и втягивает внутрь все более или менее крупные предметы. В Америке это разрушительное атмосферное явление называют торнадо."}
91;whatis;{"type":"whatis", "question":"Что такое молния?", "answer":"Молния - это мощный электрический разряд. Он возникает при сильной электризации туч или земли. Поэтому разряды молнии могут происходить или внутри облака, или между соседними наэлектризованными облаками, или между наэлектризованным облаком и землей. Разряду молнии предшествует возникновение разности электрических потенциалов между этими объектами."}
92;whatis;{"type":"whatis", "question":"Что такое железное дерево?", "answer":"На Кавказе растет железное дерево — самшит, а в тропиках можно встретить черное дерево. Все эти деревья имеют одно название — железное дерево. Такое прозвище они получили за свою очень твёрдую древесину. Она настолько прочна, что не поддается даже самому острому топору. "}
93;where;{"type":"where", "question":"Где строят дома из бумаги?", "answer":"В отдельных районах Японии строят дома из очень тонких материалов: стены в них сделаны из деревянных планок и промасленной, почти прозрачной бумаги. Строительство таких лёгких, практически бумажных домов, объясняется просто: в Японии часто бывают землетрясения. Даже если дом и упадёт, не страшно: он сложится, словно карточный домик, и никого не задавит."}
94;what;{"type":"what", "question":"Символом какой страны является Эйфелева башня", "answer":"Эйфелева башня — самая известная достопримечательность Франции. Она была построена для Всемирной выставки 1889 года из более 7 тысяч тон стали как символ достижений техники XIX века по проекту Гюстава Эйфеля."}
95;where;{"type":"where", "question":"В каком городе впервые появилось метро?", "answer":"Первая в мире линия метро появилась в Лондоне, столице Великобритании, в 1863 году."}
96;who;{"type":"who", "question":"Кто придумал телефон?", "answer":"Первым телефонный аппарат представил на суд Немецкого физического общества Иоганн Филипп Рейс в 1861 году. Немецкий изобретатель рассказал ученым мужам об изобретенном им 'проводном устройстве для электрической передачи звукового сигнала на расстоянии'. Именно Рейс назвал свое изобретение телефоном. Ознакомившись с работой аппарата, ученые пришли к выводу, что народу такая штуковина не нужна, так как сильно искажает звук. Позже американскому учёному Александру Беллу удалось убедить общественность в том, что это изобретение полезно."}
97;why;{"type":"why", "question":"В чем ценность золота?", "answer":"Причина столь притягательной силы этого металла не только в его блеске, но и в необычных свойствах. Золото - металл химически стойкий, с высокой плотностью, легко поддается обработке. Он устойчив к воздействию других химических элементов. Даже при нагревании золото не вступает в реакцию с кислородом, водородом, углеродом, азотом и щелочами."}
98;if;{"type":"if", "question":"Вредна ли Кока-Кола?", "answer":"'Кока-Кола' состоит на 90% из газированной воды, жжёного сахара, фосфорной кислоты и кофеина. Все эти компоненты не слишком полезны для здоровья!"}
99;when;{"type":"when", "question":"Давно ли люди моются?", "answer":"Мыться каждый день люди стали совсем недавно. Лет триста тому назад даже короли не считали нужным мыться ежедневно. Каждое утро он просто обтирал лицо и руки влажным полотенцем."}
100;what;{"type":"what", "question":"Чем чистили зубы в древности?", "answer":"Австрийские ученые нашли древнеегипетский манускрипт, в котором был описан состав зубной пасты. 'Порошок для белых и здоровых зубов' — так был озаглавлен найденный рецепт. Главные составляющие этого порошка — каменная соль и мята. В Болгарии был найден скелет женщины, возраст которого 9 тысяч лет. Ученые были весьма удивлены, увидев прекрасно сохранившиеся зубы правильной формы. До сих пор считалось, что зубная паста — изобретение более поздних цивилизаций."}
